{"artifact_type":"replay_result","schema_version":"1.0.0","correlation_id":"correlation-walkthrough-dfir-timeline-001","chain_verified":true,"external_action_executed":false,"timeline":[{"sequence":1,"event_time":"2026-09-15T16:11:00Z","event_type":"evidence_lineage_validated","actor_id":"service-walkthrough-gaso","outcome":"recorded","details":{"manifest_id":"manifest-walkthrough-dfir-001","derived_artifact_id":"derived-walkthrough-timeline-001","external_action_executed":false}},{"sequence":2,"event_time":"2026-09-15T16:12:00Z","event_type":"assurance_recorded","actor_id":"assurance-walkthrough-lineage-and-support-001","outcome":"recorded","details":{"assurance_result_id":"assurance-walkthrough-dfir-001","authoritative":false,"external_action_executed":false}},{"sequence":3,"event_time":"2026-09-15T16:15:00Z","event_type":"policy_allowed","actor_id":"policy-walkthrough-dfir-timeline","outcome":"allowed","details":{"decision_id":"decision:request-walkthrough-dfir-review-001:1.0.0","required_approvals":["human"],"external_action_executed":false}},{"sequence":4,"event_time":"2026-09-15T16:16:00Z","event_type":"tool_not_executed","actor_id":"service-walkthrough-gaso","outcome":"not_executed","details":{"tool_request_id":"tool-request-walkthrough-dfir-review-001","reason":"validate_only","external_action_executed":false}}]}
