{"artifact_type":"replay_result","schema_version":"1.0.0","correlation_id":"correlation-walkthrough-mdr-cloud-iam-001","chain_verified":true,"external_action_executed":false,"timeline":[{"sequence":1,"event_time":"2026-09-15T15:05:00Z","event_type":"request_validated","actor_id":"service-walkthrough-gaso","outcome":"recorded","details":{"request_id":"request-walkthrough-mdr-session-revoke-001","external_action_executed":false}},{"sequence":2,"event_time":"2026-09-15T15:05:01Z","event_type":"policy_allowed","actor_id":"policy-walkthrough-mdr-cloud-iam","outcome":"allowed","details":{"decision_id":"decision:request-walkthrough-mdr-session-revoke-001:1.0.0","required_approvals":["human","customer"],"external_action_executed":false}},{"sequence":3,"event_time":"2026-09-15T15:05:02Z","event_type":"approvals_validated","actor_id":"service-walkthrough-gaso","outcome":"recorded","details":{"approval_ids":["approval-walkthrough-mdr-human-001","approval-walkthrough-mdr-customer-001"],"external_action_executed":false}},{"sequence":4,"event_time":"2026-09-15T15:06:00Z","event_type":"tool_not_executed","actor_id":"service-walkthrough-gaso","outcome":"not_executed","details":{"tool_request_id":"tool-request-walkthrough-mdr-revoke-001","reason":"validate_only","external_action_executed":false}}]}
